Date,Cleaned_Text,Sentiment,Sentiment_Score,LikesCount,CommentsCount
2020-09-15 21:40:25+00:00,also people forgetting delay factor come greenhouse gas warming experiencing today decade past like pot water stove doesnt come boil immediately im really nervous planet going look sif make far,Negative,-0.1513,11,
2020-09-15 22:35:10+00:00,im southern ontario canada blanketed haze smoke west coast never happened,Neutral,0.0,2,
2020-09-15 22:58:59+00:00,,Neutral,0.0,0,
2020-09-20 17:38:28+00:00,bruce threlfall,Neutral,0.0,0,
2020-09-18 04:03:50+00:00,deed,Neutral,0.0,0,
2020-09-17 14:03:42+00:00,hello people happening lifetime,Neutral,0.0,0,
2020-09-17 12:47:25+00:00,interesting,Positive,0.4019,0,
2020-09-17 00:11:20+00:00,ya going happen,Neutral,0.0,0,
2020-09-16 15:28:05+00:00,soooooo,Neutral,0.0,0,
2020-09-16 13:18:06+00:00,,Neutral,0.0,0,
2020-09-16 12:55:14+00:00,thanks,Positive,0.4404,0,
2020-09-16 11:23:51+00:00,,Neutral,0.0,0,
2020-09-16 09:57:44+00:00,dont agree,Negative,-0.2755,1,3.0
2020-09-16 09:07:29+00:00,,Neutral,0.0,0,
2020-09-16 05:49:03+00:00,,Neutral,0.0,0,
2020-09-16 03:53:39+00:00,among thing,Neutral,0.0,0,
2020-09-16 01:07:12+00:00,,Neutral,0.0,0,
2020-09-16 00:43:23+00:00,wake people,Neutral,0.0,0,
2020-09-16 00:33:57+00:00,,Neutral,0.0,0,
2020-09-16 00:33:24+00:00,fake,Negative,-0.4767,0,
2020-09-16 00:11:13+00:00,,Neutral,0.0,0,
2020-09-15 23:53:57+00:00,,Neutral,0.0,0,
2020-09-15 22:59:03+00:00,vote,Neutral,0.0,3,
2020-09-15 22:32:01+00:00,msfloodpreventioncom save life land,Positive,0.4939,0,
2023-12-14 18:54:00+00:00,cant help notice hot spot world map many thermometer isnt worldwide temperature map generated model fill area without data,Negative,-0.3089,28,34.0
2023-12-14 20:00:40+00:00,becoming trend paying attention,Neutral,0.0,12,
2023-12-14 21:44:26+00:00,good game forfeit,Positive,0.4404,0,1.0
2023-12-20 18:15:56+00:00,solar maximum affect earth core way atmosphere weather,Neutral,0.0,0,
2023-12-14 18:40:45+00:00,ok like billion year im sure there time even hotter even colder stop twist thing fit narrative,Positive,0.743,24,40.0
2023-12-14 18:14:16+00:00,much denial propaganda dont understand basic science part threat life ignorance selfishness,Negative,-0.8625,20,
2023-12-17 16:40:35+00:00,every day course weve really beautiful summer day ventura county december,Positive,0.6361,0,
2023-12-16 17:07:11+00:00,caused human activity biggest lie get outta nasa climate change,Neutral,0.0,9,2.0
2023-12-17 16:43:53+00:00,denialists conspiracists show every time,Neutral,0.0,3,
2023-12-14 18:02:20+00:00,government promotes fear funding young live life free nonsense,Negative,-0.0516,10,15.0
2023-12-15 22:42:43+00:00,one thing common among climate change denier low intelligence seen clearly comment section,Positive,0.296,14,
2023-12-15 04:40:57+00:00,cant give basic description law thermodynamics closed system nothing crazyjust general overview law apply earth systemsjust top head listen opinion climate change self proclaimed critical thinker think understand complexity climate change crack,Negative,-0.128,3,3.0
2023-12-14 22:37:45+00:00,another site climate change hoax collapsed devastating series research paper published revealing human activity account c rise global temperature meaning human activity targeted radical climate change alarmist combustion engine airplane flight diesel tractor virtually measurable impact temperature planet finnish scientist spearheaded research releasing paper entitled experimental evidence significant anthropogenic climate change supported researcher kobe university japan published nearly simultaneous paper reveals change planet magnetic field govern intensity solar radiation reach lower atmosphere causing cloud formation alters global temperatureshat study published nature called intensified east asian winter monsoon last geomagnetic reversal transition,Negative,-0.6597,17,30.0
2023-12-15 19:32:02+00:00,solar flare high activity nothing higher november temperature interesting human activity cause huge impact planet change nuclear testing hydrogen bomb hugely used tested past zero accountability government world cfc blame towards hole ozone interestingly nuclear testing sensitive layer atmosphere happened nuclear testing stratosphere huge sham lack accountability real party responsible,Positive,0.7269,5,11.0
2023-12-14 16:59:04+00:00,love weather couldnt better winter unless would love,Positive,0.7902,6,5.0
2023-12-15 11:44:47+00:00,normal entering cycle happened mammoth extinguished neanderthal atlantis ice age great flood men healthy ocean som cooled planet helped thousand people survived december unable stop change protect,Positive,0.8885,7,14.0
2023-12-22 15:27:58+00:00,forgot huge information climatic changment time take full day important information need added calculation easy understand climat change normal put chiken heat f h put f h change condition meat receive heat priod well earth heat time climate getting burn long time,Positive,0.7964,0,
2023-12-14 19:54:36+00:00,thought el nio,Neutral,0.0,1,
2023-12-14 18:22:30+00:00,john kerry rescue private jet,Positive,0.5106,4,1.0
2023-12-15 16:43:54+00:00,happens politician charge climate policy instead scientist,Neutral,0.0,6,
2023-12-14 23:29:27+00:00,nasa reliable source really dont understand people ignorant,Positive,0.2057,18,31.0
2023-12-15 13:52:43+00:00,la tendencia del calentamiento se mantiene genus incertidumbre preocupacin superaremos la meta del c hay duda,Neutral,0.0,0,
2023-12-15 19:30:04+00:00,wonder population anything,Neutral,0.0,1,1.0
2023-12-15 03:23:16+00:00,canadian wilfires effect,Neutral,0.0,1,3.0
2023-12-14 17:59:40+00:00,vielleicht ist ja die nordhalbkugel zz etwas mehr der sonne zugeneigt,Negative,-0.5994,0,
2023-12-15 07:54:52+00:00,friend ben ben think climate change hoax think scientist study corrupted big climate dunno,Positive,0.2732,0,1.0
2023-12-15 15:47:22+00:00,agenda nasa pushing,Neutral,0.0,4,13.0
2023-12-14 20:33:40+00:00,joe figured fix,Neutral,0.0,6,1.0
2023-12-14 17:29:18+00:00,everyone know whats going happen happening make change yet moving faster towards catastrophic future,Negative,-0.4939,34,10.0
2023-12-14 22:58:57+00:00,oooooohotoooooobad,Neutral,0.0,0,
2023-12-15 05:06:23+00:00,,Neutral,0.0,0,
2023-12-14 22:14:03+00:00,,Neutral,0.0,0,2.0
2023-12-14 19:44:08+00:00,move thermometer back tarmac,Neutral,0.0,0,17.0
2023-12-15 07:25:17+00:00,reason global augmentation temperature,Neutral,0.0,0,4.0
2023-12-14 22:33:46+00:00,human extinction carbon atmosphere vanish earth return whatever climate trend would happened without u,Neutral,0.0,0,6.0
2023-12-14 17:19:36+00:00,november december coldest ever sweden snow since middle november getting c,Neutral,0.0,21,19.0
2023-12-14 17:37:14+00:00,back used wear sweater christmas honduras hot need inside room ac world changed get f something unprecedented,Neutral,0.0,4,4.0
2023-12-14 21:06:38+00:00,edward motzi sound like,Positive,0.3612,2,
2023-12-15 21:05:42+00:00,there still plenty flat earthers around,Neutral,0.0,0,
2023-12-15 02:03:06+00:00,happened,Neutral,0.0,2,93.0
2023-12-15 02:31:07+00:00,cada ao ser m caliente,Neutral,0.0,0,
2023-12-15 11:10:31+00:00,,Neutral,0.0,0,1.0
2023-12-24 07:26:22+00:00,time,Neutral,0.0,0,
2023-12-25 13:34:39+00:00,heavy rain heiker mendozaa,Neutral,0.0,0,
2023-12-16 18:20:51+00:00,,Neutral,0.0,3,9.0
2023-12-15 11:02:48+00:00,b,Neutral,0.0,3,1.0
2023-12-15 19:04:09+00:00,rate breath per minute join indoor air quality movement stay informed alert guiding leave area air pollution may pose health risk time inflationreductionaction energyreductionaction,Positive,0.2732,0,
2023-12-15 14:26:45+00:00,turd stain think funny,Positive,0.4404,0,
2023-12-14 21:29:19+00:00,fake garbage nasa lie,Negative,-0.4767,1,
2023-12-14 17:25:52+00:00,b,Neutral,0.0,1,
2021-10-31 16:30:32+00:00,agw linear,Neutral,0.0,3,17.0
2021-10-31 16:02:45+00:00,cue denier screaming fake news,Negative,-0.802,24,18.0
2021-10-31 20:33:24+00:00,note climb really start exactly china massive industrial development began,Neutral,0.0,4,14.0
2021-11-01 15:42:25+00:00,gaslighted heard time science global temperature measured probably easy nasa fool believe successful campaign look weather chaotic always hear think real problem appeal authority logical fallacy subject rife check opposing thought subject mostly scientist longer anything lose professor emeritus retired climate scientist tell truth orbit jupiter climate carbon sun major factor along water vapor plant die ppm carbon ppm big deal ice age carbon ppm research people,Negative,-0.7269,120,72.0
2021-11-02 06:13:57+00:00,amazing see locked warming since like turning point hit,Positive,0.7845,4,
2021-10-31 16:09:28+00:00,thats one scary graph costume,Negative,-0.4939,3,
2021-11-01 07:04:01+00:00,nasa climate change post graphic industry revolution relation co emission gas affect climate regard,Neutral,0.0,0,1.0
2021-11-01 11:27:28+00:00,yep remember cooler halloween,Positive,0.296,1,
2021-11-02 01:11:13+00:00,agree stop burning stuff probably never least lifetime,Positive,0.0772,0,
2021-11-03 13:55:11+00:00,soon possible change lifestyle,Neutral,0.0,0,
2021-11-01 15:56:25+00:00,wish shared could also share response doubter comment theyre brilliant,Positive,0.8176,1,
2021-10-31 20:48:42+00:00,erin haas brassil check anoka reference post nasa climate graph,Neutral,0.0,0,
2021-11-01 11:28:34+00:00,scary,Negative,-0.4939,0,
2021-10-31 20:22:18+00:00,planet especially earth ecosystem including human experiencing constant threat extinction humanity first climate crisis pandemic near earth flying object eg appophis asteroid ozone layer destruction magnetic field altering weakening speaking already techogenical catastrophs people thinking would helphul ourselvesbut till sceptic denying clear sign,Negative,-0.936,3,
2021-10-31 18:40:27+00:00,need know climate changeno one define big scary phrase used part moneywhich come think everything used part money seen coming,Negative,-0.4939,34,30.0
2021-11-04 02:23:09+00:00,congress negotiating away planet protection oil gas glutton winning fight time want remain hopeful getting tougher,Positive,0.7269,0,1.0
2021-11-03 20:01:07+00:00,good visual representation memory many u colder growing,Positive,0.5574,1,
2021-11-03 13:13:37+00:00,jusst jess,Neutral,0.0,0,
2021-11-02 23:20:23+00:00,carbon increase oxygen decrease graph nitrogen atmo shame cant use energy,Negative,-0.3847,0,3.0
2021-11-02 14:10:42+00:00,industrial revolution beginning end human specie,Neutral,0.0,0,
2021-11-02 10:42:40+00:00,woah nasa scariest halloween post ive seen year,Neutral,0.0,3,
2021-11-02 08:34:49+00:00,nasa climate change surely drop mic bravo,Positive,0.2023,2,
2021-11-01 20:18:58+00:00,bp c rise global surface temperature less century followed equally precipitous drop c less century anybody ever explained petit et al nature wover citation retreat laurentide glacier current location moraine ohio began year ago want know gain control global surface temperature power never going bring glacial ice pack way back cover dayton enough smother canada climate change gave u canada dont hate canada also gave u lake erie niagara fall nantucket marthas vineyard cape cod british isle scandinavia switzerland love cheese chocolate dont hate switzerland youre ever almenalp kander valley imagine kandersteg meter pack ice look alpine pasture opposite side,Positive,0.8956,5,11.0
2021-11-01 19:20:49+00:00,blaming deamoning industrialization western industrialization cause know cause kindly direct statement causing nation upgrade industrialization accommodate climate improvement,Positive,0.4588,2,
2021-11-01 17:36:50+00:00,give nasa internet liberated google scientist say youre fake let u naturally warming flat earth,Negative,-0.3612,5,
2021-11-01 12:49:15+00:00,fact house built miami south florida fireplace none anymore slowly eliminated new housing constructed north go,Neutral,0.0,1,
2021-11-01 10:46:34+00:00,thanks defining anomaly context tiresome explain term repeatedly people cannot bothered look,Positive,0.5943,19,3.0
2021-11-01 07:50:31+00:00,mother earth sorrow something,Negative,-0.5267,0,
2021-11-01 07:35:39+00:00,evidence scream collision course bad future change asap time politician get penguin ass enforce change industry reverse ominous trend,Negative,-0.9274,3,
2021-11-01 05:26:12+00:00,recurring cycle dont plan prepared destruction come,Positive,0.3252,0,2.0
2021-11-01 04:44:57+00:00,depressing,Negative,-0.3818,0,
2021-10-31 23:38:16+00:00,remember famous study climate science supported consensus humancaused climate change well published update paper journal environmental research letter figure drumroll please,Positive,0.6908,15,
2021-10-31 21:04:51+00:00,elizabeth kolbert said book sixth extinction man doomed sixth extinction act aggressively immediately address climate change,Negative,-0.7579,37,
2021-10-31 19:15:08+00:00,bad dont see oct keep going back find medieval warming period peak high back well little ice age,Negative,-0.2023,62,52.0
2021-10-31 16:14:34+00:00,scary great graphic remind everyone correlation causality know even though kid want halloween warm advent trick treating wish cause global temperature rise since consult expert know even far shown single graph edited clarity,Positive,0.8074,9,22.0
2021-10-31 16:13:21+00:00,wow year year didnt know,Positive,0.5859,1,
2021-11-01 19:44:03+00:00,jimmy valmer,Neutral,0.0,0,
2021-11-02 22:20:56+00:00,big lier earth flat weather warmnes beacause harp chemtrails andthat friend weather control new enorm,Positive,0.4939,0,
2021-10-31 20:21:34+00:00,small consolation itll high darkness fall live hopefully fewer folk burning wood triggering asthma attack misery among young old alike,Negative,-0.7269,1,
2022-12-22 18:12:11+00:00,hope someday attain level patience person running nasa social medium,Positive,0.4404,126,14.0
2022-12-24 13:24:57+00:00,great post nasa climate change doubt fossil fuel troll soon force,Positive,0.3818,7,
2022-12-22 17:45:43+00:00,weather climate climate allows extreme weather whether extreme heat cold extreme drought extreme precipitationsnow,Neutral,0.0,17,4.0
2022-12-23 05:54:15+00:00,amazing well educated people know still claim global warming today sheer coincidense hence continuing hide head sand also cant seem get head much hot weather aboutextreme weather plenty,Positive,0.7003,8,8.0
2022-12-22 16:55:06+00:00,thank research sticking science people want politicize,Positive,0.4215,43,
2022-12-22 21:41:52+00:00,perhaps new life born solution problem,Negative,-0.1027,0,7.0
2023-04-02 21:07:57+00:00,getting warmer ever since end little ice age surprising,Positive,0.4654,0,
2022-12-22 23:04:04+00:00,ppm co level atmosphere million year ago found graph claim ppm wanted see thats legit though correlation co atmosphere global avg temp anything go would explain large portion life earth cold blooded right,Neutral,0.0,0,4.0
2022-12-22 17:20:18+00:00,another graph listened randall carlson talk historic temperature sea level change source information nasa go recordsid like compare chart nasa chart go back around year ago,Positive,0.3612,10,27.0
2022-12-22 17:13:36+00:00,denier dont realize may degree colder much warmer somewhere else planet thermal energy doesnt disappear,Positive,0.354,38,1.0
2022-12-22 17:14:46+00:00,nasa climate change well climate station dispersed assumption made term comparability data back make much sense post data point individual month,Positive,0.2732,28,26.0
2022-12-23 03:05:33+00:00,temperature increase constantly rising data suggest extreme frequent hope also include extreme maybe next extreme predicted,Positive,0.6369,0,
2022-12-23 02:49:39+00:00,pleasenasa climate change every year world emits billion ton greenhouse gas atmosphere prevent climate catastrophe need reduce number zero year must act sothis measure general consumption rate planet year ad know general consumption rate year ad thank much answer love wish continued success,Positive,0.8442,1,6.0
2022-12-23 13:58:31+00:00,,Neutral,0.0,0,
2022-12-23 01:46:05+00:00,stage like temperature drop graph,Positive,0.1027,0,2.0
2022-12-22 16:55:15+00:00,,Neutral,0.0,0,
2023-01-12 00:14:21+00:00,next time youre sitting bumper bumper traffic car lined see realize every car expels pound carbon per gallon burned add,Negative,-0.3818,0,
2022-12-22 17:13:44+00:00,cite cold day evidence global warming stephen colbert said world hunger ate lunch,Negative,-0.1027,55,2.0
2023-01-09 19:11:04+00:00,area country pa lot snow plowing people republican emission law karma btch,Neutral,0.0,0,
2022-12-22 23:58:58+00:00,politician keep hand scientist well done nasa forreal,Positive,0.6486,0,
2022-12-23 13:49:13+00:00,funny every winter big blizzard clown use proof global warming true unfortunately significant percentage american vehemently deny reality human induced global warning based fact solely based political following science denial republican party one biggest threat planet,Positive,0.0516,3,
2022-12-24 11:48:53+00:00,men argue nature act,Negative,-0.34,0,
2022-12-22 18:47:19+00:00,never seen loess spelled way must american spelling,Neutral,0.0,0,2.0
2022-12-23 07:24:02+00:00,despite amazing scientific research single government world prepared address problem fossil fuel,Negative,-0.5956,1,1.0
2022-12-25 14:58:52+00:00,bring student lacking skill speed greenhouse gas global warming made graphicsrich resource ela sped student became requested college prep honor student starting greenhouse carefully move one idea next bringing student need next link offer deeper related resource humancaused atmospheric change ozone layer cfc global warming stopped global warming industry knew climate change global warming isnt natural here know climate skeptic like galileo cause california wildfire discovery global warming full century ago globalwarming climatechange teacher ngss stem ecology,Positive,0.7423,1,
2022-12-24 12:00:57+00:00,youve wrong warming since last ice age k year ago guess another ice age one day giant cycle,Negative,-0.3612,0,
2023-01-10 02:22:24+00:00,wow crazy stats,Positive,0.34,0,
2022-12-23 00:55:51+00:00,anyone think impact environment beyond ignorant,Negative,-0.2732,0,
2022-12-22 18:39:09+00:00,subir un grado e demasiado,Neutral,0.0,0,
2022-12-28 16:43:24+00:00,people cause explain still arent ice agein fact people cause climate change explain ice age recovery since cold kill people warm maybe bit global warming good thing,Negative,-0.0772,0,2.0
2022-12-22 23:09:19+00:00,weather like clothes wear particular day climate content wardrobe,Positive,0.3612,1,
2022-12-23 21:54:24+00:00,pourquoi prendre le mois de dcembre ok cest lhiver dans le nord mais cest lt dans le sud,Positive,0.296,0,
2022-12-23 00:22:47+00:00,nous acclrons toujours depuis,Neutral,0.0,0,
2022-12-23 20:20:44+00:00,nasa cant say humancausedglobalwarming doesnt mean selfexonerating pseudonym like global warming climate change land bullseye institutional denialism,Positive,0.4767,0,1.0
2022-12-24 02:07:52+00:00,started industrial age beyond never planet history rapid steady increase significant warming since beginning industrial age one pandemic shut planet drastically reduced amount carbon emission drastically noticeably positive effect slowed activity dramatic instant cant decide global slow down periodically maybe one month every year,Positive,0.8074,1,
2022-12-28 23:28:24+00:00,denier im going say short ignorance isnt bliss mean youre ignorant honestly,Negative,-0.7268,0,
2022-12-23 00:52:06+00:00,many muppets trying argue scientist satellite data hahaha,Positive,0.296,0,
2022-12-22 22:10:28+00:00,ill bet talking global cooling,Negative,-0.4215,0,
2022-12-28 15:52:52+00:00,,Neutral,0.0,0,
2023-01-11 05:28:35+00:00,fake number,Negative,-0.4215,0,
2022-12-23 02:33:48+00:00,many people understand basic fact weather climate,Neutral,0.0,4,1.0
2023-01-11 04:17:21+00:00,people absolutely nut,Neutral,0.0,0,
2023-01-06 19:05:40+00:00,greenhouse effect concerned infrared radiation given earth sun radiation basically pass oxygen nitrogen earth atmosphere land earth surface absorbed reflected back atmosphere part radiation bounce greenhouse gas return absorbed earth greenhouse gas ghgs water vapor ho carbon dioxide co nitrous oxide methane ch long co remain atmosphere difficult question several process remove carbon dioxide atmosphere co released air dissolve ocean period year rest removed several hundred thousand year according ipcc fourth assessment report co increase removed atmosphere within year another removed within century remaining may stay atmosphere thousand year mean could stop carbon dioxide emission tomorrow carbon dioxide atmosphere would continue warm climate thousand year methane ch contrast persists year thus even though methane time potent carbon dioxide effect relatively shortlived furthermore methane increased ppb ppb today notice part per billion part per million emission carbon dioxide atmosphere causing global warming much earth warm year depends upon many billion ton carbon dioxide emitted atmosphere general rule trillion ton additional carbon dioxide atmosphere actually billion translate ppm additional carbon dioxide also ppm additional carbon dioxide translates f c global warming verified fact preindustrial carbon dioxide ppm ppm period planet warmed c scientist measured amount atmospheric carbon dioxide corresponds ppm found corresponds billion metric ton co atmosphere therefore order increase global temperature c would need x billion billion metric ton carbon dioxide metric ton equal kilogram x pound u country world use metric ton world pumped billion metric ton u gt carbon dioxide atmosphere average per caput emission carbon dioxide metric ton per person per year year billion people therefore businessasusual scenario expect world emit x billion metric ton atmosphere per year average billion ton next year ie accumulation trillion ton co less tt due carbon sink ocean almost saturated co world accumulation tt carbon atmosphere dividing trillion ton co million c f mean world f warmer rise sea level come two distinct process water expansion foot due added f increased temperature melting ice mainly greenland foot antarctica foot total foot well increased extraction groundwater due irrigation although usually notice water expands slightly get warmer second potentially greater contribution rising sea level come melting glacial ice antarctica ice greenland ice trillion ton ice remaining tied continental glacier except himalaya melt greenland completely melt raise sea level foot meter antarctica completely melt add foot meter sea level rise year predict fossil fuel almost depleted coal may last temperature rise level model predicts greenland losing gt ice per year end century resulting foot sea level rise addition antarctica add another foot sea level rise adding foot thermal warming result sea level rise foot add foot due melting west antarctic ice sheet wais due collapse pine island thwaites glacier foot sea level rise end century noaa national oceanic atmospheric administration state ocean could rise foot worsecase scenario namely complete collapse wais effect would foot sea level rise u miami one vulnerable place rising sea million american would see home permanently flooded sea level rise foot sea level rise foot million american would see home permanently flooded new study predicts many million american coastal area relocate sea level rise foot meter expect likely scenario addition sealevel rise global warming contributing increase spread insectborne illness cropdamaging pest example disease zika dengue fever chikungunya transmitted mosquito pick disease biting infected people spreading people subsequent bite research shown warmer temperature shorten incubation period mean disease spread rapidly warmer temperature also tend increase geographic range insect global warming also translates extreme weather event higher temperature mean increase energy atmosphere ocean energy drive weather cannot attribute particular storm global warming tie overall trend global warming make logical sense warm ocean water give birth intense weather generally hurricane cannot survive long sea surface cooler f c longer ocean water stay f opportunity hurricane blossom lastly global warming result drought flood water scarcity demand water tripled past year currently half billion people live waterstressed country number expected increase billion vast majority fresh water used agriculture u east coast much water supply come surface water whereas midwest get water supply combination surface water well water well water come underground aquifer ogallala aquifer present rate withdrawal part ogallala aquifer water available irrigation another year,Positive,0.9871,0,
2022-12-27 04:01:11+00:00,co earth thermostat carbon dioxide little nothing global warming co currently traced ppm one carbondioxide molecule every part atmosphere human contribute scant ppm total co accumulated year co hold heat second enough drive climate change thermodynamically impossible also bear mind water vapor earth abundant effective greenhouse gas co earth chg water vapor earth ghg hold heat far longer co lastly co increase temperature rise eg el nino ocean degas conversely co level drop temperature cool word co level influenced heat lack thereof therefore drive climate follow climate clearly co actually thermometer thermostat,Positive,0.7022,0,
2022-12-25 08:20:00+00:00,,Neutral,0.0,0,
2022-12-23 22:57:24+00:00,,Neutral,0.0,0,
2023-01-06 17:20:49+00:00,kevin lay,Neutral,0.0,0,
2023-03-04 12:43:59+00:00,look phone case bitlyxmdtc think,Neutral,0.0,0,
2022-12-28 09:50:43+00:00,emen,Neutral,0.0,0,
2022-12-23 22:57:29+00:00,factvxrayy,Neutral,0.0,0,
2020-09-15 22:05:10+00:00,fault,Negative,-0.4019,1,
