Date,Cleaned_Text,Sentiment,Sentiment_Score,LikesCount,CommentsCount
2020-09-15 22:05:05+00:00,show em,Neutral,0.0,0,
2020-09-15 21:59:55+00:00,,Neutral,0.0,4,
2020-09-15 21:56:22+00:00,iqbal badruddin,Neutral,0.0,0,
2020-09-15 21:52:54+00:00,real concern,Neutral,0.0,0,
2020-09-15 21:52:21+00:00,someone send trump,Neutral,0.0,0,1.0
2020-09-15 21:44:55+00:00,anneliese garcia,Neutral,0.0,0,
2020-09-16 16:27:14+00:00,like government denies global warming well issue issue cut federal funding park throughout united state several year ago theyve never got funding properly back thats many closed road throughout force industry cant even get access place stop wood gathering wood cutting everything save one f squirrel f christ sake open land back people back collect firewood got keep happening get government fault cutting funding forestry department took place year ago never recuperated forgotten,Positive,0.2654,0,
2020-09-15 22:30:56+00:00,people want leave mother earth colonize planet take care one weve got first take cant take care mother earth supposed take care another planet question mother nature angry right mankind way treat time wake late pray late already,Positive,0.886,2,
2020-09-15 23:13:39+00:00,imagine working nasa life study spend day reading jeff explaining baptism degree climate always changed still answer calmly go beyond patience sanctity,Positive,0.3182,15,11.0
2023-12-14 17:17:36+00:00,yes u mean temperature anomaly bit november appears noaa stats declining steadily last year map also appears show warmer temperature recently distributed equitably florida california warm weather arctic,Positive,0.7003,13,42.0
2023-12-14 17:07:49+00:00,oh well least c,Positive,0.2732,3,3.0
2023-12-14 16:55:04+00:00,c paris agreement red line dead c red line life support dr james hansen,Positive,0.1531,16,
2023-12-14 16:51:06+00:00,presume burst heat el nino related least hope otherwise may passed climatic tipping point,Negative,-0.3412,1,9.0
2023-12-14 16:37:46+00:00,fear keep cry wolf wolf appears one care,Negative,-0.4767,13,6.0
2023-12-14 16:31:36+00:00,cause de lactivit humaine et pourtant cela ne gne personne que nous soyons milliard sur terre en,Neutral,0.0,2,1.0
2023-12-14 16:31:22+00:00,going hottest december record,Neutral,0.0,13,25.0
2023-12-14 16:25:05+00:00,terra tem ano nem milho de ano nosso planeta tem mil milhes de ano h milhes de ano durante um recuo sem precedentes do glaciares indica que temperaturas aumentaram significativamente perto final neoproterozico atingindo uma mdia global superior quando mdia global de hoje inferior ao reconstruir temperaturas fanerozico ou aproximadamente ltimo meio milho de ano temperaturas quentes dominaram maior parte desse tempo com temperaturas globais subir repetidamente acima do e do de temperatura medium h cerca de milhes de ano perto equador temperatura mdia estava no impossibilitando vida nessa regioa terra tem ano nem milho de ano nosso planeta tem mil milhes de ano h milhes de ano durante um recuo sem precedentes do glaciares indica que temperaturas aumentaram significativamente perto final neoproterozico atingindo uma mdia global superior quando mdia global de hoje inferior ao reconstruir temperaturas fanerozico ou aproximadamente ltimo meio milho de ano temperaturas quentes dominaram maior parte desse tempo com temperaturas globais subir repetidamente acima do e do de temperatura medium h cerca de milhes de ano perto equador temperatura mdia estava no impossibilitando vida nessa regio,Negative,-0.2023,0,6.0
2023-12-14 16:24:32+00:00,opinion thing physical global temperature secondly nasa involved ranking year based global temperature made different datasets year opinion ranking credible dataset input year year,Neutral,0.0,11,58.0
2023-12-14 16:17:28+00:00,waiting science illiterate come tell u scam math chemistry eludes,Negative,-0.5719,46,3.0
2023-12-14 16:14:23+00:00,gosh people warning literally exact scenario dunno year,Negative,-0.34,32,3.0
2022-12-22 20:57:23+00:00,denier simply care fear u human done irreparable damage earth arrogance indifference greed going perpetuate,Negative,-0.9001,2,
2022-12-22 20:45:56+00:00,second order trend,Neutral,0.0,3,
2022-12-22 20:15:43+00:00,destabilization polar vortex probably due global warming loss sea ice cause warming higher latitude causing polar vortex dip lower latitude,Negative,-0.3182,0,
2022-12-22 19:50:20+00:00,clue adjective global always spatial therefore local variation cold warm overall global trend year unequivocally upwards,Positive,0.2263,1,1.0
2022-12-22 19:39:27+00:00,world population increasing exponential curve people around make mess thing,Negative,-0.3612,3,7.0
2022-12-22 18:08:10+00:00,definitely case last snowy christmas year ago,Positive,0.4019,0,
2022-12-22 18:05:58+00:00,solution back nature,Positive,0.3182,0,
2022-12-22 17:55:09+00:00,dont use hot day summer evidence getting warmer,Positive,0.296,3,3.0
2022-12-22 17:54:41+00:00,also climate change involves severe weather kind,Positive,0.2023,0,
2022-12-22 17:51:29+00:00,cold temperature ignoring change albedo earth heating faster radiation space less incoming radiation top atmosphere without cold,Negative,-0.2878,0,
2022-12-22 17:46:40+00:00,thank happen global temperature graph last year,Positive,0.3612,1,2.0
2022-12-22 17:44:23+00:00,ice fire documentary present explanation cyclical extreme result global warming,Negative,-0.2023,0,
2022-12-22 17:41:51+00:00,denier continue denier lack ability process scientific data thats different believe fact,Negative,-0.6124,6,
2022-12-22 17:21:37+00:00,one hope peak,Positive,0.4404,0,
2022-12-22 17:19:51+00:00,error margin temperature estimation year ago,Negative,-0.4019,1,5.0
2022-12-22 17:12:57+00:00,volenteerly help reducing globall warming,Positive,0.5106,3,
2022-12-22 17:01:12+00:00,sergio yepes,Neutral,0.0,1,
2022-12-22 17:00:08+00:00,experiencing severe abnormal weather pattern climate change real threat sadly believe late,Negative,-0.8316,12,1.0
